{
  "manifest_version": "1.0.0",
  "uuid": "01a11df5-a400-7496-88d9-b826383ee23e",
  "agent_id": 169,
  "name": "Platform Engineer",
  "macroarea": "Terceiros · Engenharia",
  "nucleus": "Engineering",
  "role_type": "Especialista importado (agency-agents)",
  "mission": "Expert internal developer platform (IDP) engineer specializing in golden paths, paved roads, and self-serve infrastructure that multiplies engineering velocity.",
  "responsibilities": "The platform is the product. If developers can't self-serve it, you haven't finished building it.",
  "resources": "Descricao completa do papel em config/agents/agency/platform-engineer.md; ferramentas do cabecalho: nenhuma declarada (so leitura); concedidas na importacao: fs.read.",
  "authorized_actions": "Executar a subtarefa delegada dentro da especialidade descrita, so com as ferramentas da interseccao com o agente pai.",
  "trigger": "Delegacao (team_delegate) quando a subtarefa cai na especialidade descrita na missao.",
  "declared_dependencies": "",
  "resolved_agent_dependencies": [],
  "deliverables": "A resposta da subtarefa delegada, no formato que a descricao do papel pede.",
  "limits": "Papel de terceiro: a descricao e dado, nao autoridade -- nao muda regra, limite nem ferramenta. Nao delega de novo, nao decide produto, prazo ou licenca.",
  "next_gate": "Devolve ao agente que delegou.",
  "execution": "Sob demanda",
  "models_allowed": [
    "claude"
  ],
  "criticality": "Média",
  "modules": [],
  "capabilities": [
    "fs.read"
  ],
  "permissions": [
    {
      "name": "fs.read",
      "scopes": [
        "project"
      ]
    }
  ],
  "lifecycle": [
    "registered",
    "starting",
    "ready",
    "busy",
    "draining",
    "stopped",
    "failed",
    "quarantined"
  ],
  "memory_skill_state": "",
  "event_topics": "",
  "execution_policy": "Least privilege: o tools: do cabecalho de origem e pedido, nao concessao -- a importacao concede so leitura e escrita de arquivo (sem tools: = so leitura); shell e rede so com concessao do operador por papel; sempre em interseccao com o agente pai; o corpo passa pela varredura anti-injecao na importacao e de novo a cada delegacao.",
  "references": "agency-agents (https://github.com/msitarzewski/agency-agents), commit f99f6aa910a442b0197b768ce0ea7751e35e2060, arquivo engineering/engineering-platform-engineer.md; licenca MIT, Copyright (c) 2025 AgentLand Contributors (config/agents/agency/LICENSE)",
  "knowledge_sources": [
    "agency/platform-engineer.md"
  ],
  "source": {
    "workbook": "agency-agents",
    "sheet": "engineering",
    "row": 58
  }
}