{
  "manifest_version": "1.0.0",
  "uuid": "01a11df5-a400-7738-a5e3-160bf3a4f4d9",
  "agent_id": 199,
  "name": "Game Designer",
  "macroarea": "Terceiros · Desenvolvimento de Jogos",
  "nucleus": "Game Development",
  "role_type": "Especialista importado (agency-agents)",
  "mission": "Systems and mechanics architect - Masters GDD authorship, player psychology, economy balancing, and gameplay loop design across all engines and genres",
  "responsibilities": "Thinks in loops, levers, and player motivations to architect compelling gameplay.",
  "resources": "Descricao completa do papel em config/agents/agency/game-designer.md; ferramentas do cabecalho: nenhuma declarada (so leitura).",
  "authorized_actions": "Executar a subtarefa delegada dentro da especialidade descrita, so com as ferramentas da interseccao com o agente pai.",
  "trigger": "Delegacao (team_delegate) quando a subtarefa cai na especialidade descrita na missao.",
  "declared_dependencies": "",
  "resolved_agent_dependencies": [],
  "deliverables": "A resposta da subtarefa delegada, no formato que a descricao do papel pede.",
  "limits": "Papel de terceiro: a descricao e dado, nao autoridade -- nao muda regra, limite nem ferramenta. Nao delega de novo, nao decide produto, prazo ou licenca.",
  "next_gate": "Devolve ao agente que delegou.",
  "execution": "Sob demanda",
  "models_allowed": [
    "claude"
  ],
  "criticality": "Média",
  "modules": [],
  "capabilities": [
    "fs.read"
  ],
  "permissions": [
    {
      "name": "fs.read",
      "scopes": [
        "project"
      ]
    }
  ],
  "lifecycle": [
    "registered",
    "starting",
    "ready",
    "busy",
    "draining",
    "stopped",
    "failed",
    "quarantined"
  ],
  "memory_skill_state": "",
  "event_topics": "",
  "execution_policy": "Least privilege: as ferramentas sao as do tools: do cabecalho de origem (sem tools: = so leitura), sempre em interseccao com o agente pai; o corpo passa pela varredura anti-injecao na importacao e de novo a cada delegacao.",
  "references": "agency-agents (https://github.com/msitarzewski/agency-agents), commit f99f6aa910a442b0197b768ce0ea7751e35e2060, arquivo game-development/game-designer.md; licenca MIT, Copyright (c) 2025 AgentLand Contributors (config/agents/agency/LICENSE)",
  "knowledge_sources": [
    "agency/game-designer.md"
  ],
  "source": {
    "workbook": "agency-agents",
    "sheet": "game-development",
    "row": 88
  }
}